{
    "schemaVersion": 1,
    "title": "Static Fluent presentation patterns",
    "brandProfile": "design/brand-profiles/fluent-aligned.json",
    "theme": "light",
    "locale": "en",
    "slides": [
        {
            "id": "status-message",
            "title": "Status messages make action unmistakable",
            "takeaway": "A static status message combines semantic tone, a visible label, concise context, and an explicit owner without relying on motion or interaction.",
            "elements": [
                {
                    "id": "title",
                    "type": "text",
                    "role": "title",
                    "z": 20,
                    "box": {
                        "x": 112,
                        "y": 68,
                        "width": 1696,
                        "height": 70
                    },
                    "text": "Status messages make action unmistakable",
                    "typography": "title"
                },
                {
                    "id": "subtitle",
                    "type": "text",
                    "role": "subtitle",
                    "z": 20,
                    "box": {
                        "x": 112,
                        "y": 154,
                        "width": 1500,
                        "height": 62
                    },
                    "text": "Use semantic color only when the message carries that meaning.",
                    "typography": "subtitle",
                    "style": {
                        "color": "$secondary"
                    }
                },
                {
                    "id": "status-surface",
                    "type": "shape",
                    "group": "status",
                    "z": 4,
                    "box": {
                        "x": 112,
                        "y": 292,
                        "width": 1696,
                        "height": 284
                    },
                    "shape": "roundRect",
                    "style": {
                        "fill": "$warningSubtle",
                        "stroke": "$warning",
                        "strokeWidth": 2,
                        "radius": 16
                    }
                },
                {
                    "id": "status-icon",
                    "type": "image",
                    "group": "status",
                    "z": 10,
                    "box": {
                        "x": 160,
                        "y": 370,
                        "width": 76,
                        "height": 76
                    },
                    "path": "assets/fluent-system-icons/svg/regular/warning.svg",
                    "assetKind": "fluent",
                    "alt": "Warning status",
                    "provenance": "local-catalog",
                    "style": {
                        "color": "$warning"
                    }
                },
                {
                    "id": "status-label",
                    "type": "text",
                    "group": "status",
                    "z": 10,
                    "box": {
                        "x": 284,
                        "y": 326,
                        "width": 560,
                        "height": 40
                    },
                    "text": "DECISION REQUIRED",
                    "typography": "caption",
                    "style": {
                        "color": "$foreground",
                        "fontWeight": 700
                    }
                },
                {
                    "id": "status-heading",
                    "type": "text",
                    "group": "status",
                    "z": 10,
                    "box": {
                        "x": 284,
                        "y": 382,
                        "width": 1160,
                        "height": 62
                    },
                    "text": "Confirm the release owner",
                    "typography": "itemTitle"
                },
                {
                    "id": "status-detail",
                    "type": "text",
                    "group": "status",
                    "z": 10,
                    "box": {
                        "x": 284,
                        "y": 468,
                        "width": 1280,
                        "height": 62
                    },
                    "text": "Name one accountable owner before the next gate so the audience knows who acts.",
                    "typography": "body",
                    "style": {
                        "color": "$secondary"
                    }
                },
                {
                    "id": "owner-surface",
                    "type": "shape",
                    "group": "owner",
                    "z": 4,
                    "box": {
                        "x": 112,
                        "y": 650,
                        "width": 760,
                        "height": 144
                    },
                    "shape": "roundRect",
                    "style": {
                        "fill": "$surface",
                        "stroke": "$stroke",
                        "strokeWidth": 1,
                        "radius": 12
                    }
                },
                {
                    "id": "owner-label",
                    "type": "text",
                    "group": "owner",
                    "z": 10,
                    "box": {
                        "x": 152,
                        "y": 678,
                        "width": 260,
                        "height": 34
                    },
                    "text": "ACTION OWNER",
                    "typography": "caption",
                    "style": {
                        "color": "$muted",
                        "fontWeight": 600
                    }
                },
                {
                    "id": "owner-value",
                    "type": "text",
                    "group": "owner",
                    "z": 10,
                    "box": {
                        "x": 152,
                        "y": 728,
                        "width": 650,
                        "height": 42
                    },
                    "text": "[Name or role] · Due [date]",
                    "typography": "body",
                    "style": {
                        "fontWeight": 600
                    }
                }
            ],
            "notes": "Static native status-message pattern. Replace bracketed owner and date placeholders. Keep the warning treatment only when a real decision or risk exists."
        },
        {
            "id": "persona-owner",
            "title": "Ownership stays visible at a glance",
            "takeaway": "Static persona blocks identify accountable roles and decision rights without simulating interactive profile controls.",
            "elements": [
                {
                    "id": "title",
                    "type": "text",
                    "role": "title",
                    "z": 20,
                    "box": {
                        "x": 112,
                        "y": 68,
                        "width": 1696,
                        "height": 70
                    },
                    "text": "Ownership stays visible at a glance",
                    "typography": "title"
                },
                {
                    "id": "subtitle",
                    "type": "text",
                    "role": "subtitle",
                    "z": 20,
                    "box": {
                        "x": 112,
                        "y": 154,
                        "width": 1500,
                        "height": 62
                    },
                    "text": "Show role, responsibility, and decision relationship in one scan.",
                    "typography": "subtitle",
                    "style": {
                        "color": "$secondary"
                    }
                },
                {
                    "id": "sponsor-surface",
                    "type": "shape",
                    "group": "sponsor",
                    "z": 4,
                    "box": {
                        "x": 112,
                        "y": 300,
                        "width": 520,
                        "height": 430
                    },
                    "shape": "roundRect",
                    "style": {
                        "fill": "$brandSubtle",
                        "stroke": "$brand",
                        "strokeWidth": 2,
                        "radius": 16
                    }
                },
                {
                    "id": "sponsor-icon",
                    "type": "image",
                    "group": "sponsor",
                    "z": 10,
                    "box": {
                        "x": 160,
                        "y": 350,
                        "width": 78,
                        "height": 78
                    },
                    "path": "assets/fluent-system-icons/svg/regular/person.svg",
                    "assetKind": "fluent",
                    "alt": "Program sponsor role",
                    "provenance": "local-catalog",
                    "style": {
                        "color": "$brand"
                    }
                },
                {
                    "id": "sponsor-title",
                    "type": "text",
                    "group": "sponsor",
                    "z": 10,
                    "box": {
                        "x": 160,
                        "y": 464,
                        "width": 420,
                        "height": 52
                    },
                    "text": "Program sponsor",
                    "typography": "itemTitle"
                },
                {
                    "id": "sponsor-detail",
                    "type": "text",